{
  "$schema": "https://json-schema.org/draft/2020-12/schema",
  "title": "agk report document, schema 2",
  "description": "Hand-written; changed by hand with scripts/agk/product_report.py (SPEC-0022 rule 7). One line per kind: the fields of ITEM_KINDS.",
  "type": "object",
  "required": ["schema", "week", "opening", "sections", "notices"],
  "additionalProperties": false,
  "properties": {
    "schema": {"const": 2},
    "week": {"type": "string", "pattern": "^\\d{4}-W\\d{2}$"},
    "opening": {"type": "object", "required": ["first", "last", "as_of"], "additionalProperties": false, "properties": {"first": {"type":"string","pattern":"^\\d{4}-\\d{2}-\\d{2}$"}, "last": {"type":"string","pattern":"^\\d{4}-\\d{2}-\\d{2}$"}, "as_of": {"type":"string","pattern":"^\\d{4}-\\d{2}-\\d{2}$"}}},
    "sections": {
      "type": "object",
      "required": ["delivered", "proven", "needs_you", "at_risk", "cost"],
      "additionalProperties": false,
      "properties": {
        "delivered": {"type": "array", "items": {"oneOf": [
          {"type":"object","required":["kind","id","title","criteria","became_done","links"],"additionalProperties":false,"properties":{"kind":{"const":"requirement-done"},"id":{"type":"string"},"title":{"type":"string"},"criteria":{"oneOf":[{"type":"array","items":{"type":"string"}},{"const":"unknown"}]},"became_done":{"enum":["this-week","unknown"]},"links":{"type":"array","items":{"type":"object","required":["to","url"],"additionalProperties":false,"properties":{"to":{"enum":["pull-request","file","directory","issue","search"]},"url":{"type":"string","pattern":"^https://"}}}}}},
          {"type":"object","required":["kind","number","title","merged_on","links"],"additionalProperties":false,"properties":{"kind":{"const":"pull-request-merged"},"number":{"type":"integer"},"title":{"type":"string"},"merged_on":{"type":"string","pattern":"^\\d{4}-\\d{2}-\\d{2}$"},"links":{"type":"array","items":{"type":"object","required":["to","url"],"additionalProperties":false,"properties":{"to":{"enum":["pull-request","file","directory","issue","search"]},"url":{"type":"string","pattern":"^https://"}}}}}},
          {"type":"object","required":["kind","count","links"],"additionalProperties":false,"properties":{"kind":{"const":"pull-requests-merged"},"count":{"type":"integer"},"links":{"type":"array","items":{"type":"object","required":["to","url"],"additionalProperties":false,"properties":{"to":{"enum":["pull-request","file","directory","issue","search"]},"url":{"type":"string","pattern":"^https://"}}}}}},
          {"type":"object","required":["kind","what","links"],"additionalProperties":false,"properties":{"kind":{"const":"unknown"},"what":{"type":"string"},"links":{"type":"array","items":{"type":"object","required":["to","url"],"additionalProperties":false,"properties":{"to":{"enum":["pull-request","file","directory","issue","search"]},"url":{"type":"string","pattern":"^https://"}}}}}}
        ]}},
        "proven": {"type": "array", "items": {"oneOf": [
          {"type":"object","required":["kind","id","last_change","links"],"additionalProperties":false,"properties":{"kind":{"const":"requirement-proven"},"id":{"type":"string"},"last_change":{"type":"object","required":["number","proof"],"additionalProperties":false,"properties":{"number":{"type":"integer"},"proof":{"type":"string"}}},"links":{"type":"array","items":{"type":"object","required":["to","url"],"additionalProperties":false,"properties":{"to":{"enum":["pull-request","file","directory","issue","search"]},"url":{"type":"string","pattern":"^https://"}}}}}},
          {"type":"object","required":["kind","id","reasons","links"],"additionalProperties":false,"properties":{"kind":{"const":"requirement-not-proven"},"id":{"type":"string"},"reasons":{"type":"array","items":{"oneOf":[{"type":"object","required":["reason"],"additionalProperties":false,"properties":{"reason":{"const":"criteria-unknown"}}},{"type":"object","required":["reason"],"additionalProperties":false,"properties":{"reason":{"const":"no-criteria"}}},{"type":"object","required":["reason","ac"],"additionalProperties":false,"properties":{"reason":{"const":"no-test"},"ac":{"type":"string"}}},{"type":"object","required":["reason"],"additionalProperties":false,"properties":{"reason":{"const":"no-merged-change"}}},{"type":"object","required":["reason","number","proof","why"],"additionalProperties":false,"properties":{"reason":{"const":"not-shown"},"number":{"type":"integer"},"proof":{"type":"string"},"why":{"type":"string"}}},{"type":"object","required":["reason","number","proof","why"],"additionalProperties":false,"properties":{"reason":{"const":"unknown-proof"},"number":{"type":"integer"},"proof":{"type":"string"},"why":{"type":"string"}}}]}},"links":{"type":"array","items":{"type":"object","required":["to","url"],"additionalProperties":false,"properties":{"to":{"enum":["pull-request","file","directory","issue","search"]},"url":{"type":"string","pattern":"^https://"}}}}}},
          {"type":"object","required":["kind","count","links"],"additionalProperties":false,"properties":{"kind":{"const":"planned-not-counted"},"count":{"type":"integer"},"links":{"type":"array","items":{"type":"object","required":["to","url"],"additionalProperties":false,"properties":{"to":{"enum":["pull-request","file","directory","issue","search"]},"url":{"type":"string","pattern":"^https://"}}}}}},
          {"type":"object","required":["kind","what","links"],"additionalProperties":false,"properties":{"kind":{"const":"unknown"},"what":{"type":"string"},"links":{"type":"array","items":{"type":"object","required":["to","url"],"additionalProperties":false,"properties":{"to":{"enum":["pull-request","file","directory","issue","search"]},"url":{"type":"string","pattern":"^https://"}}}}}}
        ]}},
        "needs_you": {"type": "array", "items": {"type": "object", "required": ["group", "count", "items"], "additionalProperties": false, "properties": {"group": {"enum": ["spec", "adr", "question", "pull-request", "residual", "requirement"]}, "count": {"oneOf": [{"type": "integer"}, {"const": "unknown"}]}, "items": {"type": "array", "items": {"oneOf": [
            {"type":"object","required":["kind","id","title","links"],"additionalProperties":false,"properties":{"kind":{"const":"draft-spec"},"id":{"type":"string"},"title":{"type":"string"},"links":{"type":"array","items":{"type":"object","required":["to","url"],"additionalProperties":false,"properties":{"to":{"enum":["pull-request","file","directory","issue","search"]},"url":{"type":"string","pattern":"^https://"}}}}}},
            {"type":"object","required":["kind","id","title","links"],"additionalProperties":false,"properties":{"kind":{"const":"proposed-adr"},"id":{"type":"string"},"title":{"type":"string"},"links":{"type":"array","items":{"type":"object","required":["to","url"],"additionalProperties":false,"properties":{"to":{"enum":["pull-request","file","directory","issue","search"]},"url":{"type":"string","pattern":"^https://"}}}}}},
            {"type":"object","required":["kind","id","asked_in","links"],"additionalProperties":false,"properties":{"kind":{"const":"question"},"id":{"type":"string"},"asked_in":{"type":"string"},"links":{"type":"array","items":{"type":"object","required":["to","url"],"additionalProperties":false,"properties":{"to":{"enum":["pull-request","file","directory","issue","search"]},"url":{"type":"string","pattern":"^https://"}}}}}},
            {"type":"object","required":["kind","number","title","days","links"],"additionalProperties":false,"properties":{"kind":{"const":"pull-request-no-verdict"},"number":{"type":"integer"},"title":{"type":"string"},"days":{"type":"integer"},"links":{"type":"array","items":{"type":"object","required":["to","url"],"additionalProperties":false,"properties":{"to":{"enum":["pull-request","file","directory","issue","search"]},"url":{"type":"string","pattern":"^https://"}}}}}},
            {"type":"object","required":["kind","due","text","links"],"additionalProperties":false,"properties":{"kind":{"const":"overdue-residual"},"due":{"type":"string","pattern":"^\\d{4}-\\d{2}-\\d{2}$"},"text":{"type":"string"},"links":{"type":"array","items":{"type":"object","required":["to","url"],"additionalProperties":false,"properties":{"to":{"enum":["pull-request","file","directory","issue","search"]},"url":{"type":"string","pattern":"^https://"}}}}}},
            {"type":"object","required":["kind","id","title","links"],"additionalProperties":false,"properties":{"kind":{"const":"unspecced-requirement"},"id":{"type":"string"},"title":{"type":"string"},"links":{"type":"array","items":{"type":"object","required":["to","url"],"additionalProperties":false,"properties":{"to":{"enum":["pull-request","file","directory","issue","search"]},"url":{"type":"string","pattern":"^https://"}}}}}},
            {"type":"object","required":["kind","what","links"],"additionalProperties":false,"properties":{"kind":{"const":"unknown"},"what":{"type":"string"},"links":{"type":"array","items":{"type":"object","required":["to","url"],"additionalProperties":false,"properties":{"to":{"enum":["pull-request","file","directory","issue","search"]},"url":{"type":"string","pattern":"^https://"}}}}}}
          ]}}}}},
        "at_risk": {"type": "array", "items": {"oneOf": [
          {"type":"object","required":["kind","due","days","text","links"],"additionalProperties":false,"properties":{"kind":{"const":"residual-overdue"},"due":{"type":"string","pattern":"^\\d{4}-\\d{2}-\\d{2}$"},"days":{"type":"integer"},"text":{"type":"string"},"links":{"type":"array","items":{"type":"object","required":["to","url"],"additionalProperties":false,"properties":{"to":{"enum":["pull-request","file","directory","issue","search"]},"url":{"type":"string","pattern":"^https://"}}}}}},
          {"type":"object","required":["kind","entries","links"],"additionalProperties":false,"properties":{"kind":{"const":"pull-requests-open-long"},"entries":{"type":"array","items":{"type":"object","required":["number","days"],"additionalProperties":false,"properties":{"number":{"type":"integer"},"days":{"type":"integer"},"title":{"type":"string"}}}},"links":{"type":"array","items":{"type":"object","required":["to","url"],"additionalProperties":false,"properties":{"to":{"enum":["pull-request","file","directory","issue","search"]},"url":{"type":"string","pattern":"^https://"}}}}}},
          {"type":"object","required":["kind","entries","links"],"additionalProperties":false,"properties":{"kind":{"const":"pull-requests-sent-back"},"entries":{"type":"array","items":{"type":"object","required":["number","times"],"additionalProperties":false,"properties":{"number":{"type":"integer"},"times":{"type":"integer"},"title":{"type":"string"}}}},"links":{"type":"array","items":{"type":"object","required":["to","url"],"additionalProperties":false,"properties":{"to":{"enum":["pull-request","file","directory","issue","search"]},"url":{"type":"string","pattern":"^https://"}}}}}},
          {"type":"object","required":["kind","entries","links"],"additionalProperties":false,"properties":{"kind":{"const":"pull-requests-merged-no-verdict"},"entries":{"type":"array","items":{"type":"object","required":["number"],"additionalProperties":false,"properties":{"number":{"type":"integer"}}}},"links":{"type":"array","items":{"type":"object","required":["to","url"],"additionalProperties":false,"properties":{"to":{"enum":["pull-request","file","directory","issue","search"]},"url":{"type":"string","pattern":"^https://"}}}}}},
          {"type":"object","required":["kind","entries","links"],"additionalProperties":false,"properties":{"kind":{"const":"pull-requests-merged-not-cleared"},"entries":{"type":"array","items":{"type":"object","required":["number"],"additionalProperties":false,"properties":{"number":{"type":"integer"}}}},"links":{"type":"array","items":{"type":"object","required":["to","url"],"additionalProperties":false,"properties":{"to":{"enum":["pull-request","file","directory","issue","search"]},"url":{"type":"string","pattern":"^https://"}}}}}},
          {"type":"object","required":["kind","total","counts","open_issue","links"],"additionalProperties":false,"properties":{"kind":{"const":"drift-audit"},"total":{"oneOf":[{"type":"integer"},{"const":"unknown"}]},"counts":{"type":"object"},"open_issue":{"oneOf":[{"type":"integer"},{"enum":["none","unknown"]}]},"links":{"type":"array","items":{"type":"object","required":["to","url"],"additionalProperties":false,"properties":{"to":{"enum":["pull-request","file","directory","issue","search"]},"url":{"type":"string","pattern":"^https://"}}}}}},
          {"type":"object","required":["kind","what","links"],"additionalProperties":false,"properties":{"kind":{"const":"unknown"},"what":{"type":"string"},"links":{"type":"array","items":{"type":"object","required":["to","url"],"additionalProperties":false,"properties":{"to":{"enum":["pull-request","file","directory","issue","search"]},"url":{"type":"string","pattern":"^https://"}}}}}}
        ]}},
        "cost": {"type": "array", "items": {"oneOf": [
          {"type":"object","required":["kind","number","title","hours","fix_verdicts","links"],"additionalProperties":false,"properties":{"kind":{"const":"pull-request-cost"},"number":{"type":"integer"},"title":{"type":"string"},"hours":{"type":"string","pattern":"^(-?\\d+\\.\\d|unknown)$"},"fix_verdicts":{"oneOf":[{"type":"integer"},{"const":"unknown"}]},"links":{"type":"array","items":{"type":"object","required":["to","url"],"additionalProperties":false,"properties":{"to":{"enum":["pull-request","file","directory","issue","search"]},"url":{"type":"string","pattern":"^https://"}}}}}},
          {"type":"object","required":["kind","merged","hours","hours_unknown","fix_verdicts","behaviour_unchanged","estimate","busy","links"],"additionalProperties":false,"properties":{"kind":{"const":"week-totals"},"merged":{"type":"integer"},"hours":{"type":"string","pattern":"^(-?\\d+\\.\\d|unknown)$"},"hours_unknown":{"type":"integer"},"fix_verdicts":{"oneOf":[{"type":"integer"},{"const":"unknown"}]},"behaviour_unchanged":{"type":"integer"},"estimate":{"oneOf":[{"type":"object","required":["within","counted"],"additionalProperties":false,"properties":{"within":{"type":"integer"},"counted":{"type":"integer"}}},{"const":"none-declared"}]},"busy":{"type":"boolean"},"links":{"type":"array","items":{"type":"object","required":["to","url"],"additionalProperties":false,"properties":{"to":{"enum":["pull-request","file","directory","issue","search"]},"url":{"type":"string","pattern":"^https://"}}}}}},
          {"type":"object","required":["kind","what","links"],"additionalProperties":false,"properties":{"kind":{"const":"unknown"},"what":{"type":"string"},"links":{"type":"array","items":{"type":"object","required":["to","url"],"additionalProperties":false,"properties":{"to":{"enum":["pull-request","file","directory","issue","search"]},"url":{"type":"string","pattern":"^https://"}}}}}}
        ]}}
      }
    },
    "notices": {"type": "array", "items": {"oneOf": [
      {"type":"object","required":["kind","commit","links"],"additionalProperties":false,"properties":{"kind":{"const":"facts-commit"},"commit":{"type":"string"},"links":{"type":"array","items":{"type":"object","required":["to","url"],"additionalProperties":false,"properties":{"to":{"enum":["pull-request","file","directory","issue","search"]},"url":{"type":"string","pattern":"^https://"}}}}}},
      {"type":"object","required":["kind","version","links"],"additionalProperties":false,"properties":{"kind":{"const":"kit-version"},"version":{"type":"string"},"links":{"type":"array","items":{"type":"object","required":["to","url"],"additionalProperties":false,"properties":{"to":{"enum":["pull-request","file","directory","issue","search"]},"url":{"type":"string","pattern":"^https://"}}}}}},
      {"type":"object","required":["kind","dirty","links"],"additionalProperties":false,"properties":{"kind":{"const":"working-tree-modified"},"dirty":{"type":"string"},"links":{"type":"array","items":{"type":"object","required":["to","url"],"additionalProperties":false,"properties":{"to":{"enum":["pull-request","file","directory","issue","search"]},"url":{"type":"string","pattern":"^https://"}}}}}},
      {"type":"object","required":["kind","state","links"],"additionalProperties":false,"properties":{"kind":{"const":"metrics-issue"},"state":{"enum":["found","none-found","unknown"]},"number":{"type":"integer"},"title":{"type":"string"},"links":{"type":"array","items":{"type":"object","required":["to","url"],"additionalProperties":false,"properties":{"to":{"enum":["pull-request","file","directory","issue","search"]},"url":{"type":"string","pattern":"^https://"}}}}}},
      {"type":"object","required":["kind","state","links"],"additionalProperties":false,"properties":{"kind":{"const":"drift-audit-issue"},"state":{"enum":["found","none-found","unknown"]},"number":{"type":"integer"},"title":{"type":"string"},"links":{"type":"array","items":{"type":"object","required":["to","url"],"additionalProperties":false,"properties":{"to":{"enum":["pull-request","file","directory","issue","search"]},"url":{"type":"string","pattern":"^https://"}}}}}}
    ]}}
  }
}
