{
  "schema": 2,
  "week": "2026-W41",
  "opening": {
    "first": "2026-10-05",
    "last": "2026-10-11",
    "as_of": "2026-10-14"
  },
  "sections": {
    "delivered": [],
    "proven": [
      {
        "kind": "requirement-not-proven",
        "id": "REQ-001",
        "reasons": [
          {
            "reason": "no-merged-change"
          }
        ],
        "links": [
          {
            "to": "file",
            "url": "https://github.com/demo-org/demo-repo/blob/fabde2bb4930bf5be8250b5db8abc6d5c87371ef/docs/requirements.md#L3"
          }
        ]
      },
      {
        "kind": "planned-not-counted",
        "count": 1,
        "links": [
          {
            "to": "file",
            "url": "https://github.com/demo-org/demo-repo/blob/fabde2bb4930bf5be8250b5db8abc6d5c87371ef/docs/requirements.md"
          }
        ]
      }
    ],
    "needs_you": [
      {
        "group": "spec",
        "count": 1,
        "items": [
          {
            "kind": "draft-spec",
            "id": "SPEC-0002",
            "title": "Draft",
            "links": [
              {
                "to": "file",
                "url": "https://github.com/demo-org/demo-repo/blob/fabde2bb4930bf5be8250b5db8abc6d5c87371ef/docs/specs/0002-draft.md"
              }
            ]
          }
        ]
      },
      {
        "group": "adr",
        "count": 1,
        "items": [
          {
            "kind": "proposed-adr",
            "id": "ADR-0002",
            "title": "Proposed",
            "links": [
              {
                "to": "file",
                "url": "https://github.com/demo-org/demo-repo/blob/fabde2bb4930bf5be8250b5db8abc6d5c87371ef/docs/adr/0002-proposed.md"
              }
            ]
          }
        ]
      },
      {
        "group": "question",
        "count": 5,
        "items": [
          {
            "kind": "question",
            "id": "Q-X1-1",
            "asked_in": "docs/runs/spec-0002-notes.md",
            "links": [
              {
                "to": "file",
                "url": "https://github.com/demo-org/demo-repo/blob/fabde2bb4930bf5be8250b5db8abc6d5c87371ef/docs/runs/spec-0002-notes.md"
              }
            ]
          },
          {
            "kind": "question",
            "id": "Q-X1-11",
            "asked_in": "docs/specs/0002-draft.md",
            "links": [
              {
                "to": "file",
                "url": "https://github.com/demo-org/demo-repo/blob/fabde2bb4930bf5be8250b5db8abc6d5c87371ef/docs/specs/0002-draft.md"
              }
            ]
          },
          {
            "kind": "question",
            "id": "Q-X1-3",
            "asked_in": "docs/runs/spec-0002-notes.md",
            "links": [
              {
                "to": "file",
                "url": "https://github.com/demo-org/demo-repo/blob/fabde2bb4930bf5be8250b5db8abc6d5c87371ef/docs/runs/spec-0002-notes.md"
              }
            ]
          },
          {
            "kind": "question",
            "id": "Q-X1-5",
            "asked_in": "docs/runs/spec-0001-notes.md",
            "links": [
              {
                "to": "file",
                "url": "https://github.com/demo-org/demo-repo/blob/fabde2bb4930bf5be8250b5db8abc6d5c87371ef/docs/runs/spec-0001-notes.md"
              }
            ]
          },
          {
            "kind": "question",
            "id": "Q-X1-6",
            "asked_in": "docs/adr/0002-proposed.md",
            "links": [
              {
                "to": "file",
                "url": "https://github.com/demo-org/demo-repo/blob/fabde2bb4930bf5be8250b5db8abc6d5c87371ef/docs/adr/0002-proposed.md"
              }
            ]
          }
        ]
      }
    ],
    "at_risk": [
      {
        "kind": "drift-audit",
        "total": 0,
        "counts": {
          "D1": 0,
          "D2": 0,
          "D3": 0,
          "D4": 0,
          "D5": 0,
          "D6": 0,
          "D7": 0
        },
        "open_issue": "none",
        "links": []
      }
    ],
    "cost": []
  },
  "notices": [
    {
      "kind": "facts-commit",
      "commit": "fabde2bb4930bf5be8250b5db8abc6d5c87371ef",
      "links": []
    },
    {
      "kind": "kit-version",
      "version": "unknown",
      "links": []
    },
    {
      "kind": "metrics-issue",
      "state": "none-found",
      "links": []
    },
    {
      "kind": "drift-audit-issue",
      "state": "none-found",
      "links": []
    }
  ]
}
